{
  "verticalId": "convenience",
  "name": "Tienda de conveniencia",
  "tablet": {
    "primaryEntry": "Vender",
    "navigation": [
      "Vender",
      "Cobro",
      "Ventas de hoy",
      "Existencias",
      "Devoluciones",
      "Turno",
      "Pendientes por enviar"
    ],
    "blockedModules": [
      "proveedores completos en Tablet",
      "compras formales en Tablet",
      "conteo físico profundo en caja"
    ],
    "offlinePolicy": {
      "canContinueSelling": true,
      "copy": "Puedes seguir trabajando si la operación local está permitida.",
      "mustShowPending": true
    }
  },
  "pc": {
    "navigation": [
      "Catálogo avanzado",
      "Inventario",
      "Compras",
      "Recepción",
      "Auditoría",
      "Dashboard",
      "Sincronización"
    ],
    "governanceModules": [
      "Compras",
      "Recepción",
      "Auditoría",
      "Dashboard",
      "Sincronización"
    ],
    "copy": "PC administra configuración, auditoría y control profundo."
  },
  "screens": [
    {
      "id": "vender",
      "label": "Vender",
      "purpose": "iniciar y operar ventas",
      "primaryAction": "Buscar o escanear producto",
      "secondaryActions": [
        "Volver",
        "Cancelar",
        "Ver detalle"
      ],
      "mustDisableWhen": [
        "faltan datos obligatorios",
        "no hay permiso",
        "la operación es sensible y requiere autorización"
      ],
      "states": {
        "empty": "Tu ticket está vacío. Agrega productos para iniciar la venta.",
        "loading": "Un momento, estamos cargando.",
        "error": "No pudimos completar la acción. Intenta otra vez.",
        "success": "Listo. Operación completada.",
        "disabled": "Completa lo necesario para continuar.",
        "offline": "Puedes seguir trabajando si la operación local está permitida.",
        "pending_sync": "Se enviará cuando haya conexión."
      }
    },
    {
      "id": "cobro",
      "label": "Cobro",
      "purpose": "cerrar venta y registrar pago",
      "primaryAction": "Confirmar cobro",
      "secondaryActions": [
        "Volver",
        "Cancelar",
        "Ver detalle"
      ],
      "mustDisableWhen": [
        "faltan datos obligatorios",
        "no hay permiso",
        "la operación es sensible y requiere autorización"
      ],
      "states": {
        "empty": "No hay ticket para cobrar.",
        "loading": "Un momento, estamos cargando.",
        "error": "No pudimos completar la acción. Intenta otra vez.",
        "success": "Listo. Operación completada.",
        "disabled": "Completa lo necesario para continuar.",
        "offline": "Puedes seguir trabajando si la operación local está permitida.",
        "pending_sync": "Se enviará cuando haya conexión."
      }
    },
    {
      "id": "ventas_de_hoy",
      "label": "Ventas de hoy",
      "purpose": "consultar tickets cerrados",
      "primaryAction": "Ver detalle de ticket",
      "secondaryActions": [
        "Volver",
        "Cancelar",
        "Ver detalle"
      ],
      "mustDisableWhen": [
        "faltan datos obligatorios",
        "no hay permiso",
        "la operación es sensible y requiere autorización"
      ],
      "states": {
        "empty": "Todavía no hay ventas hoy.",
        "loading": "Un momento, estamos cargando.",
        "error": "No pudimos completar la acción. Intenta otra vez.",
        "success": "Listo. Operación completada.",
        "disabled": "Completa lo necesario para continuar.",
        "offline": "Puedes seguir trabajando si la operación local está permitida.",
        "pending_sync": "Se enviará cuando haya conexión."
      }
    },
    {
      "id": "existencias",
      "label": "Existencias",
      "purpose": "consultar disponibilidad operativa",
      "primaryAction": "Buscar producto",
      "secondaryActions": [
        "Volver",
        "Cancelar",
        "Ver detalle"
      ],
      "mustDisableWhen": [
        "faltan datos obligatorios",
        "no hay permiso",
        "la operación es sensible y requiere autorización"
      ],
      "states": {
        "empty": "Busca un producto para ver existencias.",
        "loading": "Un momento, estamos cargando.",
        "error": "No pudimos completar la acción. Intenta otra vez.",
        "success": "Listo. Operación completada.",
        "disabled": "Completa lo necesario para continuar.",
        "offline": "Puedes seguir trabajando si la operación local está permitida.",
        "pending_sync": "Se enviará cuando haya conexión."
      }
    },
    {
      "id": "devoluciones",
      "label": "Devoluciones",
      "purpose": "registrar devolución segura",
      "primaryAction": "Buscar ticket",
      "secondaryActions": [
        "Volver",
        "Cancelar",
        "Ver detalle"
      ],
      "mustDisableWhen": [
        "faltan datos obligatorios",
        "no hay permiso",
        "la operación es sensible y requiere autorización"
      ],
      "states": {
        "empty": "Busca el ticket de la venta.",
        "loading": "Un momento, estamos cargando.",
        "error": "No pudimos completar la acción. Intenta otra vez.",
        "success": "Listo. Operación completada.",
        "disabled": "Completa lo necesario para continuar.",
        "offline": "Puedes seguir trabajando si la operación local está permitida.",
        "pending_sync": "Se enviará cuando haya conexión."
      }
    },
    {
      "id": "turno",
      "label": "Turno",
      "purpose": "abrir, revisar o cerrar caja",
      "primaryAction": "Abrir o cerrar turno",
      "secondaryActions": [
        "Volver",
        "Cancelar",
        "Ver detalle"
      ],
      "mustDisableWhen": [
        "faltan datos obligatorios",
        "no hay permiso",
        "la operación es sensible y requiere autorización"
      ],
      "states": {
        "empty": "No hay turno abierto.",
        "loading": "Un momento, estamos cargando.",
        "error": "No pudimos completar la acción. Intenta otra vez.",
        "success": "Listo. Operación completada.",
        "disabled": "Completa lo necesario para continuar.",
        "offline": "Puedes seguir trabajando si la operación local está permitida.",
        "pending_sync": "Se enviará cuando haya conexión."
      }
    },
    {
      "id": "pendientes_por_enviar",
      "label": "Pendientes por enviar",
      "purpose": "explicar operaciones locales no enviadas",
      "primaryAction": "Reintentar envío",
      "secondaryActions": [
        "Volver",
        "Cancelar",
        "Ver detalle"
      ],
      "mustDisableWhen": [
        "faltan datos obligatorios",
        "no hay permiso",
        "la operación es sensible y requiere autorización"
      ],
      "states": {
        "empty": "Todo está enviado.",
        "loading": "Un momento, estamos cargando.",
        "error": "No pudimos completar la acción. Intenta otra vez.",
        "success": "Listo. Operación completada.",
        "disabled": "Completa lo necesario para continuar.",
        "offline": "Puedes seguir trabajando si la operación local está permitida.",
        "pending_sync": "Se enviará cuando haya conexión."
      }
    }
  ],
  "flows": [
    {
      "id": "convenience.happy_path",
      "name": "Flujo principal",
      "steps": [
        "Entrar a Vender",
        "Ejecutar venta de productos por código de barras, ticket rápido, efectivo, tarjeta, devolución simple y corte de turno",
        "Corregir errores simples",
        "Confirmar operación",
        "Ver resultado claro"
      ],
      "blockedBy": [
        "permiso insuficiente",
        "dato obligatorio faltante"
      ],
      "successMessage": "Operación completada."
    },
    {
      "id": "convenience.offline_path",
      "name": "Operación sin conexión",
      "steps": [
        "Mostrar aviso simple",
        "Guardar operación local",
        "Marcar pendiente por enviar",
        "Permitir continuar si la política lo permite"
      ],
      "blockedBy": [
        "operación crítica no permitida sin conexión"
      ],
      "successMessage": "Guardado en esta Tablet. Se enviará después."
    },
    {
      "id": "convenience.error.producto_no_encontrado",
      "name": "Manejo de producto no encontrado",
      "steps": [
        "Detectar producto no encontrado",
        "Mostrar mensaje simple",
        "Ofrecer corrección o regreso",
        "Evitar cierre silencioso"
      ],
      "blockedBy": [
        "producto no encontrado"
      ],
      "successMessage": "Dato corregido."
    },
    {
      "id": "convenience.error.producto_sin_stock",
      "name": "Manejo de producto sin stock",
      "steps": [
        "Detectar producto sin stock",
        "Mostrar mensaje simple",
        "Ofrecer corrección o regreso",
        "Evitar cierre silencioso"
      ],
      "blockedBy": [
        "producto sin stock"
      ],
      "successMessage": "Dato corregido."
    },
    {
      "id": "convenience.error.precio_faltante",
      "name": "Manejo de precio faltante",
      "steps": [
        "Detectar precio faltante",
        "Mostrar mensaje simple",
        "Ofrecer corrección o regreso",
        "Evitar cierre silencioso"
      ],
      "blockedBy": [
        "precio faltante"
      ],
      "successMessage": "Dato corregido."
    },
    {
      "id": "convenience.error.código_duplicado",
      "name": "Manejo de código duplicado",
      "steps": [
        "Detectar código duplicado",
        "Mostrar mensaje simple",
        "Ofrecer corrección o regreso",
        "Evitar cierre silencioso"
      ],
      "blockedBy": [
        "código duplicado"
      ],
      "successMessage": "Dato corregido."
    }
  ],
  "microcopy": {
    "primary": "Vender",
    "success": "Operación completada.",
    "error": "No pudimos completar la acción. Intenta otra vez.",
    "offline": "La operación quedó guardada en esta Tablet. Se enviará después.",
    "pending": "Pendiente por enviar.",
    "disabled": "Completa lo necesario para continuar.",
    "special": {